title,label
영상 버닝썬 직원 겸 아오리라멘 점주인 김모 씨 영장실질심사 출석,0
승리 라멘집 하루 매출 70 떨어져선긋기 나선 점주들,0
이름값→골칫덩이승리 라멘집 점주 우린 승리와 관련 無,0
아오리라멘 측 승리·유리홀딩스와 관계 정리관련 매장은 폐업공식입장,-1
버닝썬 게이트’ 수사 유인석 앞에서 멈췄다,-1
승리 라멘집 가맹점주 버닝썬승리와 관계 없다” 선긋기,0
SC초점승리 국내외 망신살킴림과 진실게임X라멘집은 아우성,0
승리 라멘집 아오리라멘 측 가맹점주 보호 위해 새 전문경영인 영입할 것,0
버닝썬 게이트’ 수사 유인석 앞에서 멈췄다,-1
승리 라멘집 버닝썬 사태 이후 매출 상황은,0
승리 라멘집 가맹점주 버닝썬승리와 관계 없다” 선긋기,0
SC초점승리 국내외 망신살킴림과 진실게임X라멘집은 아우성,0
아오리라멘 측 승리·유리홀딩스와 관계 정리 공식입장 전문,0
로이킴 몰카 논란에 장수막걸리 불매운동 확산···아오리라멘 전철 밟,-1
영장심사 출석하는 아오리 라멘 점주 김 모 씨,0
아오리라멘 새대표 유씨와 친분관계점주에 3천만원 가맹비 환불,0
승리 아오리라멘집 하루 매출 폭락점주들 있을 수 없는 일,0
영장심사 출석하는 아오리 라멘 점주 김 모 씨,0
아오리라멘 새대표 유씨와 친분관계점주에 3천만원 가맹비 환불,0
승리 아오리라멘집 하루 매출 폭락점주들 있을 수 없는 일,0
승리 아오리라멘 측 유리홀딩스와의 관계 정리할 것,0
버닝썬 불씨 장수막걸리 불매운동 번져,-1
연예인경찰 가교 역할 유리홀딩스 대표 유인석은 누구인가,0
아오리 라멘 승리 게이트 사태에 매출 70 급감우린 관계없는데,-1
승리 라멘집 버닝썬 사태 이후 매출 반토막” 울상,-1
버닝썬 사태 이후 아오리라멘 가맹점 카드매출 최대 73 줄어,0
버닝썬에서 마약 거래가 있었다는 폭로가 또 나왔고 승리는 아오리라멘 ,0
버닝썬 사태 이후 아오리라멘 가맹점 카드매출 최대 73 줄어,0
버닝썬에서 마약 거래가 있었다는 폭로가 또 나왔고 승리는 아오리라멘 ,0
버닝썬’ 불똥에 승리 라멘집 직격탄,-1
승리 경영 라멘집 승리유리홀딩스와 관계 정리 하기로”공식입장,0
버닝썬 불똥이 라멘집에 튀었다 승리의 라멘집 점주 불매 운동 확산될까 전,-1
전 승리 라멘집 아오리 라멘 승리로 홍보할 땐 언제고빠른 손절에도,0
승리 라멘집 승승장구 마무리 업주들 울고 싶어라버닝썬 후푹풍 어디까,0
아오리 라멘 점주 영장심사,0
버닝썬 횡령·성접대 승리 구속 여부 14일내일 판가름4000억 벌면 이,-1
아오리라멘 점주들 어쩌나 불매운동 확산 日 유명한 이치란라멘 벤치마킹,-1
아오리라멘 점주들 어쩌나 불매운동 확산 日 유명한 이치란라멘 벤치마킹,-1
승리의 아오리라멘→로이킴의 장수막걸리 유명세가 독이 된 오너리스크,-1
손님 줄었다아오리라멘 승리 사건에 매출 ↓ TD점검,0
승리 라멘집 버닝썬’ 게이트→매출 폭락가맹점주 피해 호소뉴스데스크,-1
승리 라멘집 승리와 전혀 무관지켜봐 달라”,0
승리 라멘집 가맹점주 모집 일단 스톱올해 확장계획 미정,0
뉴스데스크 승리 라멘집 하루 매출액 70 하락,-1
글로벌Biz 24 성접대 의혹 승리의 아오리라멘 호찌민점 문닫아,-1
빅뱅 승리 버닝썬에 이어 아오리라멘 사내이사직도 사임,0
진짜 행방불명 위기승리 라멘집 가맹점주들 집단소송 가나,-1
진짜 행방불명 위기승리 라멘집 가맹점주들 집단소송 가나,-1
버닝썬 사태 이후 승리 라멘집 카드매출 73 급감,-1
2000만원 경찰 안줬다···버닝썬 대표 승리 지키려고 조작,0
승리 라멘집 버닝썬 영향 손님 발길 뚝오너리스크 손해배상 관심,-1
사고는 승리가 치고 피해는 왜 우리가 보나요 버닝썬 논란에 한숨 쉬는 아,-1
승리 라멘집 불매 움직임가맹점주 타격으로 번지나,-1
뉴스데스크 승리 라멘집 매출 70 하락점주들은 무슨 죄,-1
빅뱅 승리 버닝썬 이어 라멘집 이사직도 사임했다,0
★포토영장실질심사 출석하는 아오리 라멘 점주 김 모 씨,0
승리 사태’ 직격탄 아오리라멘 매출 74 급락 가맹점주 피해 늘어”,-1
승리 라멘집 무려 75 매출 급감母 홍대명동 지점 가맹점주 총회도 참석,-1
김영주 의원 승리 아오리라멘 최대 73 매출하락  연예인 브랜드 매출하,-1
오너리스크 아오리라멘 불매운동 확산승리 보상 책임에 관심,-1
승리 라멘집 아오리라멘 가맹점주들 선긋기 나섰다 승리와 무관,0
승리 라멘집 초토화 되나 울고 싶어라발걸음 뚝 후폭풍 역대급,-1
뉴스데스크 승리 라멘집 점주들 2차 피해 매출 74 폭락 충격,-1
빅뱅 승리 직접 운영하는 아오리라멘 경품 행사서 양현석 동명이인 뽑아 화들,0
승리·정준영 동업 밀땅포차 폐업 상태 해당 건물 3층에 승리 아오리라멘,-1
ST포토 아오리라멘 점주 김 모씨 피의자 심문 출석,0
머니랩 승리 라멘집 발길 뚝가맹점주들 직접 만나보니,0
ST포토 아오리라멘 점주 김 모씨 피의자 심문 출석,0
머니랩 승리 라멘집 발길 뚝가맹점주들 직접 만나보니,0
승리 라멘 사임 군입대 준비 과정일 뿐,0
승리 라멘집  비즈니스도 선긋기인가 연예계 은퇴 결심 이어  무고한 가맹,0
승리라멘 아오리라멘은 어쩌나,0
승리 아오리라멘집 초토화 되나 울고 싶어라발걸음 뚝 후폭풍 역대급,-1
승리 동업자 유인석과 이번엔 구속 성접대 호텔비 3000만 원 결제 덜미,0
승리라멘집 지인 가족 운영매장 폐업절차기존 점주보상안 마련,-1
아오리라멘 가맹점주 승리 라멘집 흔적 지워라,0
승리 라멘집 승리와 전혀 무관맛으로 승부하겠다,0
승리 동업자 유인석과 이번엔 구속 성접대 호텔비 3000만 원 결제 덜미,0
승리라멘집 지인 가족 운영매장 폐업절차기존 점주보상안 마련,-1
아오리라멘 가맹점주 승리 라멘집 흔적 지워라,0
빅뱅 승리 라멘집 사내이사도 사임군 복무 때문,0
승리 라멘집 승리와 전혀 무관맛으로 승부하겠다,0
아오리라멘’ 사업 승리 엄마 말렸다 그냥 하고 있는 빅뱅이나 잘해라”,0
현장 가맹점 무슨 죄손님 뚝 끊긴 승리 라멘집,0
승리 라멘집’ 아오리 라멘 매출급락 집단 손해배상 청구 가능성은,-1
버닝썬 영향 승리 라멘집 손님 발길 뚝점주들 그분 땜에 다 말아먹게 ,0
로이킴 불똥 튄 장수막걸리다른 주주는 무슨 죄,-1
버닝썬 영향 승리 라멘집 손님 발길 뚝점주들 그분 땜에 다 말아먹게 ,0
단독 인터뷰 류재욱 아오리라멘 신임 대표 유인석 사업파트너 아닌 고객과,0
ST포토 아오리 라멘 점주 김 모 씨 버닝썬 이사 장 모씨 호송차로 이동,0
버닝썬 사건 일파만파승리 아오리라멘 사내이사 사임,0
승츠비 분노 승리 라멘집 가맹점주 억 매출 어쩌나,0
뷰티 업계로 번진 버닝썬 파문JM솔루션도 뒤흔들까,-1
승리 연예인 종훈과 가장 오래된 친구 다정한 사진 포착 아오리라멘 가맹점주,0
승리의 아오리라멘 호식이방지법 처벌 1호 되나,0
8월14일 아오리라멘에 소비자 후쿠시마 원산지 바꿔라” 항의,-1
승리 라멘집  비즈니스도 선긋기하나  연예계 은퇴 언급에 이어,0
승리의 아오리라멘 호식이방지법 처벌 1호 되나,0
빅뱅 승리 버닝썬 이어 라멘집 이사직도 사임,0
8월14일 아오리라멘에 소비자 후쿠시마 원산지 바꿔라” 항의,-1
승리 라멘집  비즈니스도 선긋기하나  연예계 은퇴 언급에 이어,0
종합 연매출 250억→70하락승리 라멘집 직격탄→구속 정준영 45월 재,-1
아오라라멘 측 승리·유리홀딩스와 관계 정리”불매운동에 대처,-1
뉴스데스크’ 승리 라멘집 매출 폭락점주들 무관하다” 호소문까지,-1
기자의눈 잃어버린 고객신뢰 되찾으려 안간힘 쓰는 기업들,0
빅뱅 승리 초록우산 어린이재단에 아오리라멘 수익금 1억원 기부,1
가맹·대리점만 애꿎은 피해오너리스크 보상은 요원,-1
빅뱅 승리 초록우산 어린이재단에 아오리라멘 수익금 1억원 기부,1
가맹·대리점만 애꿎은 피해오너리스크 보상은 요원,-1
정준영·최종훈·승리 동업 밀땅포차 현재는 폐업,-1
승리 라멘집 1만원 라멘 맛 평가 어땠나 보니,0
승리 라멘 가게로 화제 아오리라멘 여전히 유리홀딩스 홈페이지에 이름 있,0
승리 버닝썬 이어 라멘사업 사내이사도 사임,0
이슈종합 승리 라멘집 유명세 탄 아오리라멘 일부 가맹점주 선긋기 승리,0
이화연의 요리조리 승리 리스크’가 보여준 가맹사업법 빈틈,-1
오너리스크에 또 흔들리는 식품업계 미스터피자 상폐 카운트다운,-1
승리 라멘집’ 인식 선긋기 나선 가맹점주들 승리와 무관합니다”,0
이슈종합 승리 라멘집 유명세 탄 아오리라멘 일부 가맹점주 선긋기 승리,0
이화연의 요리조리 승리 리스크’가 보여준 가맹사업법 빈틈,-1
정준영·승리 밀땅포차이미 폐업 후 현재는 고깃집,-1
오너리스크에 또 흔들리는 식품업계 미스터피자 상폐 카운트다운,-1
승리 라멘집 가맹점주 승리와 관계 없다아오리라멘 승리 가족 및 지인 관,0
승리 라멘집’ 인식 선긋기 나선 가맹점주들 승리와 무관합니다”,0
성추행·마약·폭행 오너리스크 몸살방지법은 무용지물,-1
빅뱅 승리 버닝썬 이어 라멘사업 이사직도 사임,0
승리 라멘사업도 정리버닝썬 마약 권유 추가폭로종합,0
이슈 유리홀딩스의 유 후아유,0
이슈 유리홀딩스의 유 후아유,0
현장에서오너리스크 방지법으로 일자리 늘리는 법,-1
기자수첩 버닝썬 나비의 날갯짓 어디까지 미치려나,0
승리 버닝썬 이어 라멘 사업 사내이사직도 사임,0
현장 성관계 몰카’ 정준영 모든 혐의 인정” 울컥,-1
후쿠시마 원전 근처에서 육수 공급 소문 승리 라멘집 엎친데 덮친격 가맹,0
빅뱅 승리 성접대 카톡 가수 C씨’ 정체는 아오리라멘 사장’박한별 남,0
버닝썬 VIP 직원이 마약 권유 폭로 → 승리 라멘 사내이사 사임 엑s 이슈,0
승리 라멘집으로 유명세 탄 음식점 승리 사태로 줄어드는 판매량에 승리,0
더셀럽포토영장실질심사 출석한 아오리 라멘 점주 김 모 씨,0
버닝썬 VIP 마약 복용 권유받았다 증언,0
빅뱅 승리 초록우산 어린이재단에 아오리라멘 수익금 1억원 기부,1
로이킴 몰카 논란에 장수막걸리 불매운동 확산,-1
YG·방송사·황금 인맥 승리·정준영 흔적 지우고 선 긋고,0
단독 승리 아빠 내 아들은 클럽 대표 아니다조만간 입장 발표”,0
아오리라멘 계산대에서 당당했던 승리의 모습아오리라멘 불매운동에 와글,-1
공공돋보기 또 불거진 가맹점 오너 리스크,-1
이슈진단 불매운동에 손님 뚝’승리라멘 가맹점주 한숨만,-1
아오리라멘 불매운동 벌어지나피해는 가맹점에 고스란히,-1
승리 라멘집 처음에 엄마가 사업한다고 반대 빅뱅만 잘해라,0
승리 라멘집 매출 75 급감母 홍대명동 지점 가맹점주 총회도 참석했다,-1
FT아일랜드 최종훈 경찰에 음주운전 공개 말아달라 파문,-1
정준영·승리·최종훈 운영했다는 밀땅포차 현재 폐업한 것으로 알려져,-1
혼밥탐방 빅뱅 승리의 아오리 라멘 인기 식당이지만 혼밥하기 어색함 없,1
영상뉴스 승리 라멘집 점주 잘못 없어도 방문 꺼려져”,0
오너일가 마약 개인일탈 왜 우리가 피해보냐성추행·폭행 등 오너리스크,-1
버닝썬 게이트 열리자 승리 가족이 한 일은 일방적 모함 주장 변했나,-1
오너리스크’ 피해 가맹점주 손해배상 받을까 올해 계약 맺거나 갱신한 ,-1
생일 날 연탄 봉사하고 1억 원 기부한 승리,1
승리 라멘집 잡음,0
단독 정준영X승리X최종훈 밀땅포차 현재 폐업 상태,-1
승리 라멘집 잡음,0
매출 75 감소 승리 라멘집 가족 상생 언급 母 홍대명동 지점 가맹점주다,0
최종훈 아오리라멘 국내 33호점 오픈한 가맹점주 승리의 가장 오래된 친구,1
마약·폭행·성희롱·배임 각양각색 오너리스크에 우리만 죽는다,-1
경영진 비행 따른 손해배상 가능할까승리 라멘집 가맹점주 울상,-1
승리·유인석 배후지목 류재욱 그들은 고객윤총경도 모른다는데,0
공식입장광역수사대 측 승리 소환계획無 성접대 의혹 내사中차후 논의,0
장수막걸리 불매운동 확산에 로이킴 개인 회사 아냐,-1
hot_issue 키워드로 본 승리게이트’ 전모  특권층의 민낯,-1
곳곳에서 터져 나오는 탄식들 승리 라멘집 가맹점주 답답 대체 어떤 일이,0
승리 아오리라멘 육수공장 위치 논란 후쿠시마 원전 안전지대 아니다,-1
빅뱅 승리 클럽 버닝썬 이어 라멘사업 사내이사직도 사임,0
군입대로 사내이사 못한다던 승리 아오리라멘 사내이사는 유지중,0
승리 절친 최종훈 지난해 아오리라멘 국내 33호점 가맹점주됐다 그의 가장,0
승리X정준영 동업한 밀땅포차 이미 폐업 상태,-1
★해시태그 승리 아오리라멘 수익금 1억 기부 임직원·스태프 감사,1
버닝썬 사태 이후 아오리라멘 가맹점 카드매출 최대 73 하락,-1
승리 라멘집 발끈,0
issue 위대한 승츠비’ 승리의 성공 신화는 왜 흔들리나,0
승리 라멘집 발끈,0
issue 위대한 승츠비’ 승리의 성공 신화는 왜 흔들리나,0
도의적 보상 받은 승리 라면’ 점주들 법적 보상은,0
승리 라멘집 가맹점주 손님 발길 뚝 아오리라멘,0
Invest승리의 PEF 아이돌 등극 실패뒤늦게 부각된 사모펀드 인맥,0
버닝썬 사건 터진 뒤 다시 보니 성지글이었던 예언 5가지,0
승리 라멘집 불매 점주들 어쩌나 그분 때문에 다 말아먹게 생겨” 과거 월,-1
승리게이트 불똥 장수막걸리·남양유업불매운동까지 홍역,-1
밀땅포차 멤버는 누구 청담동 가게 현재 폐업,-1
아오리라멘 빅뱅 승리유리홀딩스와 관계 끊었다피해방지할 것,-1
함께 이자카야 오픈” 승리와 동업 중인 한국 가수 2인,1
김보영의 키워드 회장 퇴진·손해배상대기업·프랜차이즈 총수 칼바람,0
로이킴 리스크 장수막걸리 발빠른 선긋기에도 불매운동 확산,-1
승리 라멘집 불매운동시상식까지 참석했던 모습보니 불과 2달 전,-1
승리 라멘집 가맹점주 대분노 속사정버닝썬 사태로 초토화 울고 싶어,-1
승리 클럽 버닝썬 폭행 논란버닝썬 VIP 폭로 직원이 마약 권유했다 승리,-1
승리 라멘 가맹점주들 오너 리스크 손해배상 왜 못 받나,-1
승리 초록우산 어린이재단에 아오리라멘 수익금 1억원 기부,1
fn스트리트 버닝썬 게이트,-1
피해 입증 모두 가맹점주 몫 유명무실 오너리스크법’ 뉴스,-1
버닝썬 실소유주라는 몽키뮤지엄 사단 H씨는 누구 승리 업체 몽키뮤지엄,0
승리 라멘집’ 매장당 월매출 2억 최종훈도 운영해 승리 사건 이후 승리 라,0
미운우리새끼 승리 라멘집 비화는母 빅뱅만 잘해라,0
빅뱅 승리 초록우산어린이재단에 1억원 기부,1
아오리라멘 점주는 무슨 잘못 승리 카톡 논란에 깊어지는 한숨,-1
디스패치 밀땅포차 카톡방 승리정준영최종훈 불법 동영상 공유,0
승리 꼼수논란 슬금슬금 발 빼기 대중 신뢰 바닥,-1
최종훈 승리·정준영과 얼마나 친한가 도쿄 번개·라멘 점주vs절친 방,0
아오리라멘 최종훈 33호점 점주 변신,0
단독 승리 어머니 운영 와플 카페 앤드히어 폐업 내막,-1
김영주 의원 연예인 명성에 의존하는 가맹사업의 오너리스크 매우 높아 대,-1
나 혼자 산다 승리 라멘집 CEO의 일상 공개 베트남 호치민까지 접수,0
빅뱅 승리 초록우산 어린이재단에 아오리라멘 수익금 1억원 기부,1
FT아일랜드 최종훈 소속사 FNC엔터테인먼트 이틀째 연락 두절무슨 일,0
승리 라멘집 수익 중 1억원 기부 아이들 승리하도록”SNS★컷,1
이를 어째 승리 라멘집 가맹점주 답답하네 곳곳에서 터져 나오는 탄식,0
버닝썬 논란’ 승리 프랜차이즈 외식업체 사내이사직도 사임,-1
승리에 울고 웃고 프랜차이즈의 스타 리스크’,-1
천지일보 이슈종합 김은경 전 장관 구속영장 기각·환경부 블랙리스트 의혹,0
오너리스크 폭망한 식품업계 막전막후,-1
오너리스크 폭망한 식품업계 막전막후,-1
장수막걸리 확실히 선 그었는데 냉랭하게 라면집 등 줄줄이,0
빅뱅 승리 알고보면 선행천사 2년 연속 1억원 기부,1
승리 라멘 아오리라멘’ 즐거운과 모바일 쿠폰 선물하기 판매 개시,0
승리 라면’ 측 유리홀딩스와 관계 정리하겠다더니···신임 대표 논란,-1
버닝썬에서 놀고 베트남에서 사업하자”몰락한 승츠비 비즈니스 스토리,0
승리 라멘집 가맹점주 울상오너 리스크 손해배상받을 수 있을까,-1
발걸음 뚝 끊긴 승리 라멘집 매장 운영 초토화 되나울고 싶어라,-1
승리 라멘집 수익금 일부 기부임직원분들 감사,1
사면초가 대성성매매 알선죄 적용 가능성은,0
승리 라멘집 수익금 일부 기부임직원분들 감사,1
승리 초록우산 어린이재단에 1억 기부연탄 기부도 3년째 공식,1
사면초가 대성성매매 알선죄 적용 가능성은,0
해외까지 강타한 승리 게이트원정 성접대·물뽕 성폭행 구설에 오른 각국,-1
사장님이라 불러다오사업가로 대박난 국내 연예인 5인,1
안병익의 식신 맛집 겨울을 녹이는 진한 국물의 로맨스 라멘 맛집,1
식음료외식업계 오너 리스크’로 다시 몸살,-1
YG·방송사·황금 인맥 승리·정준영 흔적 지우고 선 긋고,0
빅뱅 승리 유리홀딩스 대표도 사임여전히 매니저가 감사 꼼수 논란,-1
아오리라멘 불매운동까지매장 45개·각 월매출 2억원,-1
빅뱅 승리 초록우산어린이재단에 1억원 기부,1
연예인 인기 따라 등락스타 리스크에 우는 프랜차이즈,1
아오리라멘 불매운동까지매장 45개·각 월매출 2억원,-1
현장ㅣ 승리 버닝썬 논란 후 첫 콘서트 사과했지만의혹해결 無종합,-1
오늘의 뉴스톱5 정준영 1박2일 하차 JYP 트와이스 멤버 루머법적대,0
유인석 유리홀딩스 대표 박한별도 속였다 금융업계vs투자회사,0
버닝썬 사건 해명해” 비난 쏟아지는 승리 인스타그램,0
버닝썬 게이트 확전 속 성접대 의혹 번진 유리홀딩스’ 실체 추적,-1
오너 리스크 손해배상 가능할까속앓이 중인 승리 라멘집 가맹점주,-1
남다른 우정 돋보이는 남자 연예인 4인방승리최종훈정준영로이킴,0
버닝썬 사건 해명해” 비난 쏟아지는 승리 인스타그램,0
버닝썬 게이트 확전 속 성접대 의혹 번진 유리홀딩스’ 실체 추적,-1
빅뱅 승리 2년연속 초록우산 어린이재단에 1억원 기부 공식입장,1
오너 리스크 손해배상 가능할까속앓이 중인 승리 라멘집 가맹점주,-1
남다른 우정 돋보이는 남자 연예인 4인방승리최종훈정준영로이킴,0
최민환 과거 아오리라멘서 맛있는 한끼 냠냠다이어트는 내일부터,0
SK·현대·남양유업만 문제일까오너 一家 관리 특단 필요,-1
승리 라멘집 어쩌나 경제적 피해 속출,-1
승리 여동생 관심폭발에 근황도 공개 라멘집44호점 베트남호치민 오픈,1
스마슈머의 역습 한국은 단 한번도 성공한 적이 없다비웃는 日 누른 韓,0
승리 여동생 관심폭발에 근황도 공개 라멘집44호점 베트남호치민 오픈,1
스마슈머의 역습 한국은 단 한번도 성공한 적이 없다비웃는 日 누른 韓,0
일방적 모함 주장했던 승리 가족 버닝썬 게이트 열리자 한 일은,-1
생일을 더욱 뜻깊게 빅뱅 승리 초록우산어린이재단에 1억 기부,1
살림남2 김승현 딸과 승리 아오리라멘 청담점서 롱패딩 데이트 인증샷,0
승리 근황 홍콩 가수 용조아와 인증샷 환한 미소,1
승리 훈훈 비주얼 뽐내며 찰칵아오리라멘 47호점이 오픈했습니다,1
스마슈머의 역습물건 하나 살 때도 온라인과 비교쇼루밍족에 진화하는 ,1
라멘만 연매출 1천억원 정도 라멘집 50호점 오픈 알린 영앤리치 승리,1
승리 클럽 버닝썬 폭행논란 승리 뭐하나 봤더니상받네,-1
승리 지난해 이어 생일에 1억 기부 연탄 봉사도 3년째,1
라멘만 연매출 1천억원 정도 라멘집 50호점 오픈 알린 영앤리치 승리,1
승리 클럽 버닝썬 폭행논란 승리 뭐하나 봤더니상받네,-1
이시각 연예스포츠 핫뉴스 승리 은퇴 선언·디스패치 정준영 몰카 논란·FT,-1
카드뉴스 조양호 일가 갑질 남양유업 황하나 등 오너리스크로 구설수에,-1
아오리라멘 가맹점주 승리 연예인 절친 종훈이네 다정한 사진 저와 가장 오,0
승리 대중 신뢰 뚝꼼수 논란까지슬금슬금 발 빼나,-1
아오리라멘 홍대 등 다양한 먹거리의 홍대 맛집베스트10 소개,1
빅뱅 승리 VR기업 사장 타이틀 하나 더295억원 투자 유치 성공,1
버닝썬 승리 은퇴 선언 후 남은 숙제 3가지,0
빅뱅 승리 VR기업 사장 타이틀 하나 더295억원 투자 유치 성공,1
버닝썬 승리 은퇴 선언 후 남은 숙제 3가지,0
FT아일랜드 최종훈 알고보니 승리 라멘집 가맹점주돈독한 친분 눈길,0
버닝썬 게이트 9개월 핵심 4인방 근황 추적,-1
승리 성매매알선 등 7개 혐의 검찰 송치12억 횡령 혐의도,-1
빅뱅 승리 생일 맞아 초록우산 어린이재단에 1억 기부,1
버닝썬 폭행 사건’ 논란될 때 승리가 간 곳은,-1
FT아일랜드 최종훈 과거 승리 라멘집에서 한컷 가맹점주 되신 최종훈님과 함,0
승리 생일 맞아 연탄케이크에 촛불 분 승츠비 3년차 봉사”SNS★컷,1
EBN 오늘14일 이슈 종합 서울 공동주택 공시가 1417 상승 고개 숙인 승,0
승리 라멘집 점주 B씨 답답한 심경 보호받을 수 있는 게 없더라,0
빅뱅 승리는 수완 좋은 청년사업가인가 사기꾼인가,0
사장님 타이틀 고사한 승리 크리에이티브 디렉터로 VR사업 참여,0
빅뱅 승리 올 들어 2번째 열애설이번엔 인형미모 유혜원,0
채이배 시장 압력으로 문제 오너 복귀 막아야,-1
승리 매출감소 책임 소송오너리스크 피해 인정될까,-1
빅뱅 승리 아오리라멘 벤처 인증받아 뿌듯하지만 겁나기도”,0
中 매체 이번엔 승리·유혜원 암스테르담 포옹사진 공개,0
스마슈머의 역습제품 생산부터 단종까지 좌우진화하는 프로슈머,1
탤런트 김승현 딸 김수빈과 다정한 데이트부인과 이혼 이유는,0
유혜원·빅뱅 승리 열애설 이틀째 확산소속사 사실 확인 중,0
오늘Who 빅뱅의 승리 위대한 승츠비 향해 가상현실사업 도전,0
경찰 가수 승리를 성매매알선’ 포함 7개 혐의로 검찰에 송치,-1
빅뱅 승리 오늘12일 생일 맞아 초록우산 어린이재단에 1억 기부 공식,1
승리 라멘집 설리 인증 아오리 라멘 맛있다 제일 매운 맛,0
글로벌 브랜드 노린다” 빅뱅 승리 이번엔 VR 사업 크리에이티브 디렉터,0
★해시태그 설리 승리 아오리 라멘 인증샷 맛있어,0
불법영업 논란 대성 수사 본격화승리는 여전히 답보SS초점,-1
빅뱅 막내’ 승리의 몰락성매매알선 횡령 등 7개 혐의 검찰 송치,-1
승리 버닝썬→라멘 사업 이사직 사임 군복무 위한 정리일 뿐,0
승리 성매매알선 등 7개 혐의 검찰 송치12억 횡령 혐의도종합,-1
미우새 승리 라멘집 아오리라멘 매출 공개매장당 2억 원 총 매장 45개,0
뉴스 속 직업 지드래곤·탑 마약 파문 이번엔 승리 성접대 의혹 이중적,-1
뉴스현장 호날두 노쇼 주최사 상대 손해배상 소송 첫 접수,-1
설리 월매출 2억 승리 라멘집 방문 인증 아오리 라멘♥마이,0
나혼자 산다 승리 여동생 인스타 근황 오빠랑 붕어빵승리 여동생 직업·,0
버닝썬 게이트 또 다른 연결고리 몽키뮤지엄 버닝썬 설립 후 문 닫은 내막,-1
