title,label
버거킹 한국 자체 개발 메뉴 몬스터와퍼 100만 개 판매 기록,0
생활 속 현실화된 로봇진화된 푸드테크에 노동력 대체 우려도,1
육가공업체들 식물고기 시장 잇단 진출,1
초콜릿 버거 진짜야”버거킹 만우절 이색 마케팅,0
아마존 누가 불질렀나8월 한 달간 4만여 건 화재 발생,0
미 육류업계 인조고기 인기 심상찮네”,1
소멸 앞둔 이통사 멤버십 포인트연말 어떻게 활용할까,0
한 눈에 보는 신상품 오뚜기 프리미엄 XO 만두 외1월 410일,1
IT큐레이션 새롭지만 새로울 것 없는 구독경제 빛과 그림자,0
기자수첩 LG전자 지금은 맞고 그때는 틀리다,0
근거리 물류 스타트업 바로고’ 120억 규모 시리즈B 투자 유치,1
햄버거값 다 올랐다버거킹 일부 메뉴 100원씩 가격 인상,0
기계는 말이 없다감정 노동 시키는 키오스크,0
버거킹 세계 도넛의 날 기념해 와퍼 도넛’ 한정 판매,0
버거킹 와퍼 세트 10년 전 가격인 5700원에 먹을 수 있다,0
2019 부산국제광고제 결산 전문가·일반인 경계 잊은 열정 넘치던 배움의,0
하루 종일 킹처럼 즐겨라’ 버거킹 올데이킹 프로모션 30일까지 진행,0
항공오늘 제주항공 기내 에어카페 프로모션 실시대한항공 셀프 체크인 ,0
KFC와 버거킹이 연내 모든 매장에 키오스크무인주문기계 도입 결정했다,0
버거킹 몬스터와퍼 X 코카콜라 모바일 앱 코크 플레이,0
버거킹 매출은 뛰는데 수익은 뚝,0
맥도날드 2월행사 맥도날드 햄버거세트가 단돈 4900원” 버거킹·롯데리아·,0
대한항공 다음달 18일까지 셀프 체크인 경품행사,0
양평물맑은 시장 토요일 청개구리 마켓 첫 개장,0
버거킹 더블킹 시리즈 신제품 더블치킨맨’ 출시,1
핫 CEO 재계 대표로 고군분투 박용만 대한상공회의소 회장,0
글로벌 마케팅 컨퍼런스 DMS 2019 오는 3월 코엑스서 개최,0
버거킹 43만 버거팬 열광한 만우절용 초콜릿와퍼 공개,0
유통·외식업계 핼러윈 데이 마케팅 시동파티 용품부터 이색 메뉴까지 봇,0
SK네트웍스 주유소 이어 전기차 충전 사업 본격 진출,1
버거킹 초콜릿 와퍼 출시한다고,1
유통·외식업계 핼러윈 데이 마케팅 시동파티 용품부터 이색 메뉴까지 봇,0
SK네트웍스 주유소 이어 전기차 충전 사업 본격 진출,1
버거킹이 만우절 맞아 야심차게 내놓은 초코 듬뿍 초콜릿 와퍼,0
롯데리아맥도날드 이어 버거킹도 햄버거 값 올린다,0
인싸Eat트럼프 햄버거·김영철 스테이크 음식의 정치학,1
이베스트證 부·울·경 지역 대학생 주식 모의투자대회 개최,0
버거킹 팬톤과 손잡고 여름맞이 젤리에이드 3종 출시,1
여기어때 운영사 위드이노베이션 최문석 대표이사 취임,0
소고기 성분 든 식물성버거 논란···채식주의자 정체모를 메뉴,-1
카스 퀴어축제 응원해” 무지개색 광고···성소수자 응원한 대표 브랜드,0
위메프88특가 숫자 겹치는 날 이벤트 뿌링클콜라가 8888원,0
햄버거 배달시키면 강아지용 버거는 덤,0
인터뷰 김동진 롯데리아 법인장 한국식 치밥 베트남 입맛 사로잡은 비,0
외식업계 새해 할인와퍼주니어 11부터 다양한 할인 혜택,0
버거킹 2일부터 와퍼 등 12개 메뉴 100원씩 올린다,0
더벨불안하지 않은 두산의 신사업 도전,0
넥슨 야생의 땅 듀랑고에서 버거킹 햄버거 먹자,0
한 밤 중에 버거가 고플 땐 버거킹 24시간 딜리버리,0
5배 몸값 올린 공차가 부러운 사모펀드 소유 프랜차이즈들,0
버거킹 햄버거세트 단돈 4900원” 버거킹 12월 행사 외 맥도날드·맘스터치,0
데일리마켓뉴스 한국전자금융 무인기기 성장성은 유지가 위안KB증권,1
버거킹 몬스터와퍼 출시 한 달 만에 100만 개 판매 돌파,1
버거킹 한국 진출 34주년 기념 와퍼 세트 10년 전 가격 할인 행사,1
사람과 지구 생각하는 공정무역 미래 세대를 움직이죠,0
이베스트투자證 부울경 대학생 주식 모의투자대회,0
버거킹 와퍼 3종 3900원 할인 행사 진행,0
버거킹 2일부터 햄버거 10종 등 일부 메뉴 100원씩 인상,0
물류 스타트업 바로고 120억원 규모 시리즈B 투자 유치,1
KT 12월 더블할인 멤버십 대상 공개 및 룰렛 이벤트 실시,0
일동제약 아로나민 UN지원SDGs협회의 지속가능 우수 브랜드로 선정,0
버거킹 프리미엄 와퍼 3종 할인 행사 실시,0
버거킹도 와퍼 100원 인상햄버거업계 가격인상 러시,0
어벤져스 엔드게임 VOD 비씨카드로 어셈블,0
가성비우선주의 소비자 위해 롯데·버거킹·하이네켄 등 잇단 대용량 제품,0
위메프 88특가 이벤트 진행매 시각 초특가 타임딜 판매,0
버거킹 더블킹 시리즈 신제품 더블치킨맨’ 선봬,1
열악한 배달 시장에서 새로운 비즈니스 기회 잡았죠”,1
추석특집 혼추족·D턴족·추캉스 겨냥한 이벤트 풍성,0
월간십일절 빕스 90 할인권구매 방법주의사항 정리,0
월간십일절 빕스 90 할인권구매 방법주의사항 정리,0
KT 5Good위크’로 캐리비안베이 반값에 즐기세요,0
대한항공 셀프 체크인하고 경품도 타세요”,0
버거킹 등 8개 업체 불법 고용계약 조사,0
이벤트 넥슨 야생의 땅 듀랑고 버거킹 제휴 프로모션,1
버거킹 초콜릿 듬뿍 담은 햄버거 초콜릿 후퍼’ 출시알고보니 만우절 이,1
귀여운 디스전 살벌한 디스전,0
월드컵 버거킹 러시아러시아 선수 아이 임신하면 평생 공짜 성차별적,0
버거킹 카톡 플친에게 몬스터와퍼’’몬스터X’ 무료 세트 업 쿠폰 증정,0
햄버거 가격 줄줄이 인상버거킹 와퍼’ 100원 오른다,0
버거킹 카톡 플친에게 몬스터와퍼’’몬스터X’ 무료 세트 업 쿠폰 증정,0
햄버거 가격 줄줄이 인상버거킹 와퍼’ 100원 오른다,0
라이프쇼 브리핑 3D 프린팅 맞춤 안경 브라기 출시 외,1
맥도날드 유럽서 빅맥’ 상표권 상실,0
일동제약 아로나민 UN지원SDGs협회 가장 지속가능한 브랜드 우수그룹에 선,0
버거킹과 카톡 플친 맺고 프리미엄 와퍼 특별한 가격으로 즐겨요,0
맛·재미 다 잡은 이색 조합 뜬다식품업계 이색 페어링’ 메뉴 주목,1
유앤비X유니티 버거 광고모델 발탁 대세 입증’,1
촉매제·소셜미디어·현실과 디지털 간 연결성 올해 칸 라이언즈 수상작들,1
배달 패스트푸드업계엔 독일까 약일까,0
촉매제·소셜미디어·현실과 디지털 간 연결성 올해 칸 라이언즈 수상작들,1
배달 패스트푸드업계엔 독일까 약일까,0
KT 12월의 더블할인 멤버십 혜택은,0
보기만 해도 맛있어 군침 당기는 메뉴 세 가지,0
암호화폐 열기 속으로··· KFC 코닥 버거킹 등 5개 기업 사례,0
일동제약 아로나민 UN지원SDGs 선정 지속가능’ 브랜드 선정,0
KT멤버십 7월 워터파크 74까지 할인,0
추석 연휴 이커머스 사용설명서쿠팡 로켓배송·이베이 e쿠폰 특가,0
無人 시대①月 인건비 220만원 절감알바 자리 넘보는 키오스크,0
대한항공 셀프 체크인 이용하는 승객 대상으로 경품 주는 행사,0
대한항공 셀프 체크인 이용하는 승객 대상으로 경품 주는 행사,0
야생의땅 듀랑고 버거킹과 프로모션현실가상에서 햄버거 먹자,0
백화점서 쇼핑 루프톱서 한잔 베트남 젊은이 홀린 K스타일’,0
버거킹 가격인상 막차’햄버거값 줄줄이 오른다,0
하노이에 상륙한 롯데 센터’ 세계 10대 도시 전망대로 선정,0
버거킹 오늘19일부터 일주일간 와퍼 3종 단돈 3900원,0
버거킹 와퍼 세트 10년 전 가격’ 할인 행사,0
뉴스투데이 E BC카드 마블팬 위한 엔드게임 VOD 이벤트 개최,0
한솥 글로벌 지속가능한 브랜드 40’ 선정,0
버거킹 몬스터와퍼 출시 한달만에 100만개 판매,1
에듀윌 올해 하반기 공기업 대기업 필기시험 응시했다면 선물 증정,0
햄버거 전문점 버거킹 사모펀드 경영의 한계일까,0
해커스경찰 회원가입만 해도 경찰 공무원 인강 무료 수강권 제공,0
신상 뜯어보기맵단 한국인 입맛 취항 저격버거킹 몬스터와퍼,1
바로고 120억원 규모 투자 유치기업가치 1000억원 평가,1
시그널 육가공 업체 마니커에프앤지 내달 코스닥 입성,0
구독의 시대 유튜브형 브랜드 저널리즘으로 대응하라’,0
에듀윌 공기업·대기업 취준생 대상 필기시험 후기 수집 이벤트 실시,0
버거킹2일부터 와퍼 등 12개 메뉴 가격 100원씩 올린다,0
배달중개 스타트업 바로고 기업가치 1천억으로 급성장,0
진짜 고기 맛이네” 대체육류 한국인 밥상 채운다,0
벚꽃 콘 vs 버거맥도날드·버거킹 한정판 메뉴 격돌,0
듀랑고에 햄버거가 넥슨 야생의 땅 듀랑고 X 버거킹 프로모션 실시,0
한솥 UN지원SDGs협회 지속가능 글로벌 브랜드 40’ 선정 인증서 전달식,0
대한항공 셀프 체크인하고 경품 타세요,0
버거킹 와퍼세트 등 10년 전 가격 할인행사,0
모바일 한게임 신맞고 12일 김준현vs나미춘 빅매치 공개 방송 진행 예고,0
ZZIM 버거킹 신메뉴 다이나믹 BBQ,1
코스트코·버거킹·이마트 유전자변형’ 가공식품 최다 수입,0
대체육류 한국인 밥상에도 등장수요 급증한 이유는,0
대체육류 한국인 밥상에도 등장수요 급증한 이유는,0
피플IN허진수 SPC그룹 부사장 캄보디아에 합작법인,0
버거킹 2일부터 일부 메뉴 가격 인상,0
버거킹 몬스터와퍼넥슨 야생의 땅 듀랑고 콜라보 기념 이벤트 실시,0
축구 선수 아이를 임신하라” 버거킹 비난에 광고 삭제,0
올해 식품업계 화두는 가격 인상더 얇아진 국민 지갑,0
배달 늘리고·키오스크 설치하고 변화하는 패스트푸드,0
치킨에게도 복지를英 KFC 新유럽양계복지 기준 준수 약속,0
트렌드줌인 소비자 pick 경험 마케팅 vs 언택트 마케팅,1
한 번을 먹어도 버거킹 이번엔 와퍼세트’를 10년 전 그 놀라운 가격에 득,0
한 번을 먹어도 버거킹 이번엔 와퍼세트’를 10년 전 그 놀라운 가격에 득,0
근거리 물류 스타트업 바로고 120억 규모 시리즈 B 유치,1
대한항공 셀프 체크인 이용하고 경품도 타고,0
식품업체들 당황하게 만든 역대급 이물질 논란 사례 4가지,-1
머니 창업단신죽이야기 베트남 창업 이민 전담팀 구축 外,0
버거킹 몬스터와퍼가 내 모바일 속으로,0
버거킹 와퍼 11 쿠폰 선착순 증정 행사 실시,0
공무원 대표 커뮤니티 공드림 간식문화상품권한국사꿀팁 나눔 이벤트 진행,0
버거킹 2일부터 일부 메뉴 100원 가격 인상,0
기고 K프랜차이즈 세계화 공동진출 모색할 때,1
파리바게뜨·롯데리아·다이소 2018 최고의 프랜차이즈’ 1위,1
일동제약 아로나민 지속가능한 브랜드 우수그룹’ 선정,0
넥슨 야생의 땅 듀랑고 버거킹과 제휴 프로모션,1
버거킹 올데이킹 론칭인기 버거세트 4900원 판매,1
대한항공 셀프 체크인 이용하면 경품 행운이,0
햄버거 너마저버거킹 12개 메뉴 100원씩 올린다,0
무인주문계산대 앞에선 얼음디지털 소외 심각,0
버거킹 더블킹 시리즈 신제품 더블치킨맨 출시,1
한밤중에도 이른 아침에도 집에서 24시간 편리하게 버거킹을 즐겨보세요,0
매경 100대 프랜차이즈 CEO 열전 20 정현식 해마로푸드서비스 회장  가성,0
한밤중에도 이른 아침에도 집에서 24시간 편리하게 버거킹을 즐겨보세요,0
매경 100대 프랜차이즈 CEO 열전 20 정현식 해마로푸드서비스 회장  가성,0
글로벌 지속가능 리더 일동제약 아로나민 코카콜라구글과 어깨 나란히,0
ZZIM 버거킹 신메뉴 크리미 모짜볼,1
쓱닷컴 22주년 할인 행사최대 80 싸게,0
버거킹 오늘부터 와퍼 등 12개 메뉴 가격 인상,0
버거킹 프리미엄 와퍼 3종 3900원에 판매,0
메쉬코리아 부릉’ 버거킹 전직영점으로 배달 대행 확대,0
버거킹 응원 기운 담은 시즌 한정판 출시,1
광고기획의 새로운 방향으로 핵버타이징 제안한 버거킹,1
버거킹 와퍼 11 쿠폰 선착순 증정 행사 진행,0
야생의 땅 듀랑고 버거킹 제휴 프로모션 실시,1
버거킹 킹대킹’ TV CF 온에어투표 이벤트 진행,0
더벨이상하 네오플럭스 대표 PE로 영역 확대 현재진행형,0
21개 업체 1회용컵 수거량 72 감소한 까닭,0
버거킹 2일부터 와퍼 등 12개 상품 가격 인상,0
일동제약 아로나민 전 세계 가장 지속가능한 브랜드 우수그룹 선정,0
롯데리아·맥도날드 햄버거 배달료 소비자 모르게 올려 뒤통수,0
까맣게 타들어가는 지구의 허파 아마존누가 불 질렀나,0
버거킹 사내 신메뉴 공모전 개최,1
버거킹 사내 신메뉴 공모전 개최,1
버거킹 7월 한정 KING BOX 3종 출시,1
마음껏 게으르게 사세요”,0
2018 칸 지상중계 버거킹의 특별한 제안 핵버타이징 Hackvertising,0
버거킹 더블킹 시리즈 신제품 더블치킨맨 출시,1
지속성장 위한 브랜드 전략은 칸 라이언즈X서울 18일 개막,0
美버거킹선 개 눈치 볼 필요없어직화구이 개껌 등장,0
물류 스타트업 바로고 120억 규모 시리즈 B 유치기업가치 1000억 평가,1
버거킹 와퍼’ 등 12종 가격 인상 단행,0
SSG닷컴 쓱가 대축제 열어최대 80 할인,0
버거킹 세트메뉴에 사이드 담은 킹박스’ 출시,1
SSG닷컴 22주년 기념 쓱가 대축제최대 80 할인,0
英 KFC 新유럽양계복지 기준 준수할 것”,0
해커스경찰 예비 경찰을 위한 회원가입 이벤트’ 진행,0
버거킹 너 마저인건비·임대료 다 올라,0
폭염·폭우에 무방비인 라이더들 사계절 내내 위험의 질주,0
버거킹 국민이 선택한 좋은 광고상’ 수상,1
버거킹 몬스터X 구입시 타바스코 1병 무료 증정 행사,0
버거킹 햄버거 가격 100원 인상대표 햄버거 업체들 가격인상 완료,0
BC카드 어벤져스 엔드게임’ 네이버 VOD 출시 기념 이벤트 진행,1
BC카드 어벤져스 엔드게임’ 네이버 VOD 출시 기념 이벤트 진행,1
커피전문점·패스트푸드점 일회용 컵 사용 34 감소,0
역대급 버거 이벤트완전 혜자라고 난리난 버거킹 11 이벤트,0
버거킹 만우절 가짜 신메뉴와 세트 업 이벤트 눈길,1
대한항공 셀프 체크인 이용하고 경품도 타세요,0
버거킹 프리미엄 와퍼 3종 할인 행사 진행,0
버거킹 팬톤과 함께한 여름맞이 젤리에이드 3종 출시,1
롯데리아 vs 버거킹의 4번째 승부수는 킹 치킨버거,0
악몽 버거·탄산수 코스튬 핼러윈 마케팅 美 올해 10조 규모 특수,0
버거킹 와퍼 등 12개 메뉴 100원씩 올려햄버거 가격 줄인상,0
버거킹 한국 진출 34주년 기념 와퍼세트 10년 전 가격’ 할인 행사 진행,1
이베스트투자증권 부울경 지역 대학생 주식 모의투자대회’ 개최,0
버거킹 불고기버거 50 대박 할인 이벤트 진행,1
버거킹 만우절 초콜릿와퍼 영상 화제네티즌 진짜 팔면 안돼,0
가짜 고기 이어 가짜 달걀 시대 왔다,0
버거킹마저햄버거 가격 다 올랐다,0
버거킹의 황당한 러시아 월드컵 판촉 행사,0
완전 초코케이크 아니야 버거킹 초콜릿 와퍼” 출시  이벤트 영상,1
연말 달라진 이통사 멤버십 포인트 혜택은,0
작년 커피전문점·패스트푸드점 개인컵 이용 1천만 건,0
커피전문점·패스트푸드점 1회용컵 수거량 72 감소,0
월드컵 러시아 버거킹 선수 아이 임신하면 평생 공짜’ 황당 광고 논란,-1
11월 1일부터 롯데리아 제품·서비스 가격 올라햄버거값 줄줄이 가격인상 또,0
식물성고기 만드는 벤처 美상장 대박,1
신메뉴에 TV CF·이벤트버거킹 공세 강화,1
위메프 88특가 매 시각 특가상품 보니 에어팟2·뿌링클·에스티로더 파데,0
버거킹KFC 등 가격 오른 햄버거배달 최소금액도 잇달아 껑충’,0
MT리포트배달의 민족’은 배달을 할까,0
IPO기자간담회 닭고기 기업 마니커 코스닥 노크,0
네슬레가 내놓는 인공고기 버거고기보다 단백질 더 풍부,0
상반기 화제작 어벤저스 비씨카드로 결제해서 보세요,0
스타벅스부터 하얏트까지···플라스틱 빨대 퇴출하겠다,-1
버거킹 햄버거값도 오른다와퍼 100원 인상,0
버거킹 5월 가정의 달 기념 킹박스KING BOX 3종 재출시,1
Show me the TV’ LG‧삼성 TV부문 디스전’ 본격화,0
중국 유통혁명 현장을 가다QR코드로 테이블 주문에 직원 팁까지 18분內 배달,0
근거리 물류 스타트업 바로고 120억 규모 시리즈 B 유치,1
설왕설래 식물성 고기,0
버거치킨 업계 가을 입맛 사로잡는 신제품 러시 치즈맛 VS 매운맛,1
한솥 UN지원SDGs협회 지속가능 글로벌 브랜드 40’ 선정 인증서 전달식 열,0
한솥 UN지원SDGs협회 지속가능 글로벌 브랜드 40’ 선정 인증서 전달식 열,0
박지윤 21일 인스타그램을 통해 일상 공개,0
1회용컵 줄이기’ 9개월月 수거량 72 줄었다,0
커피전문점·패스트푸드점 일회용컵 수거량 1년새 72 감소,0
슬픈 눈은 이제 그만 SNS 휩쓴 댕댕이용 햄버거,0
코스트코 GMO 가공식품 최대 수입처,0
공정위 세븐일레븐·이마트24 가맹본부 실태 조사 나서,0
버거킹 일주일간 와퍼 세트 10년 전 가격에 판매,0
서브웨이도 대체육류 샌드위치 판매,0
KT 7월 멤버십 혜택 공개워터파크 50 할인,0
서브웨이도 대체육류 샌드위치 판매,0
KT 7월 멤버십 혜택 공개워터파크 50 할인,0
버거킹 등 패스트푸드 자주 먹는 아이 ADHD 위험↑,0
에이픽스게이밍 어디계세요 제품 인증 이벤트 진행,0
대한항공 셀프 체크인 이용 경품 행사,0
메쉬코리아 배달 서비스 버거킹 전직영점 확대,0
소비자가 뽑은 패스트푸드점 칙필레 No1”,0
버거킹 와퍼 세트 10년 전 가격’ 할인 행사,0
버거킹 2일부터 가격 인상,0
버거킹 일부 메뉴 100원씩 인상햄버거 다올랐다,0
햄버거 가격 올리면서 배달수수료도 죄다 인상한 맥날X롯데리아X버거킹,0
대한항공 휴가철 셀프 체크인 경품행사,0
국내 글로벌 식품브랜드 역수출로 웃었다,0
월정액 서비스 선보인 커넥츠 스카이에듀,0
대한민국 대표 프랜차이즈 한솥도시락 2019 굿시즈 컨벤션 행사 도시락 후원,0
버거킹 25일까지 와퍼 3종 3900원에 판매,0
버거킹 오늘29일부터 일주일간 와퍼세트 5700원10년 전 가격,0
넥슨 야생의 땅 듀랑고’ X 버거킹’ 제휴 프로모션 실시,1
배달대행 고속성장 이면에 배달노동자 폭염·폭설 무방비,0
노브랜드 버거 직접 먹어보니1900원에 이런 맛이’,0
배달대행 고속성장 이면에 배달노동자 폭염·폭설 무방비,0
노브랜드 버거 직접 먹어보니1900원에 이런 맛이’,0
버거킹 5월 감사의 달 맞아 다양한 프로모션 진행,0
SSG닷컴 신세계몰 오픈 22주년 쓱가 대축제’최대 80 할인,1
버거킹 2일부터 와퍼 등 12개 메뉴 100원 인상,0
버거킹 사내 신메뉴 공모전 2018 쇼미 유어 아이디어’ 개최,1
바로고 120억 규모 시리즈 B 유치기업가치 1000억원 평가,1
일동제약 아로나민 전 세계 가장 지속가능한 브랜드 우수그룹 선정,0
일회용컵 사용 확 줄었다매장내 수거량 9개월 새 72↓,0
커피전문점·패스트푸드점 1회용컵 수거량 72 감소,0
일회용컵 사용 확 줄었다매장 내 수거량 9개월 새 72↓,0
커피전문점·패스트푸드점 1회용컵 수거량 72 감소,0
햄버거 고객 충성도 1위는 인앤아웃,1
일동제약 아로나민 UN지원SDGs협회 선정 전 세계 가장 지속가능한 브랜드 ,0
나는 약물중독자입니다④ 아이언 맨’은 약물중독자였다,0
SK텔레콤·KT 통신사 8월 할인 통해 도미노피자·CGV 영화예매·버거킹 저렴,0
넥슨 야생의 땅 듀랑고’ 버거킹 제휴 프로모션,1
외식물가 들썩 햄버거 빅3 줄줄이 인상 대열 합류,0
천호엔케어 건강기능식품 아이키쑤욱’ 모델로 SKY캐슬’의 배우 김병철,0
롯데컬처웍스 동영상 플랫폼 씨츄 집캉스’족들 위한 다채로운 이벤트,0
더벨어피너티의 버거킹 日진출롯데 운영권 살얼음,1
버거킹 킹박스KING BOX로 속도 든든 마음도 든든,0
논단질문으로 알아보는 동물복지,0
딜링룸 백브리핑 英 골드만·JP모건은 페북·애플보다 행복하다,0
에듀윌 2019 하반기 공기업대기업 필기시험 후기 작성 이벤트 실시,0
KT 5Good 위크로 캐리비안베이 반값에 즐기세요,0
버거킹 강남 지역서 24시간 딜리버리 서비스 시행,0
게임투데이 넷마블 쿵야 캐치마인드 출시 외,1
에듀윌 하반기 공기업 NCS·대기업 필기시험 후기 이벤트 마련,0
버거킹 킹대킹 TV CF 온에어투표 이벤트 실시,0
버거킹 몬스터와퍼’ X 코카콜라 모바일 앱 코크 플레이’ 콜라보 프로,0
딥페이크는 어떻게 마케팅에 위협이 되나,0
커넥츠 스카이에듀 전 강좌 무제한 수강 월 9천900원,0
내년 최저임금 심의 본격화 프랜차이즈업계 인건비 부담 가중에 예의주시,0
디지털 마케팅 성공하려면 모바일 네이티브에 맡겨라,0
2018 유통 10대 뉴스 최저임금·오너갑질로드숍 부도에 살길 찾기’,-1
기묘한 협업,0
커피전문점·패스트푸드 매장 일회용컵 수거량 72 줄었다,0
커피패스트푸드 브랜드 21곳 1회용 컵 사용 72 줄었다,0
브라질 상파울루서 대규모 동성애자 축제300만명 참가,0
버거킹 국내 단독 신메뉴 몬스터와퍼 2종 10주 한정 출시,1
카드뉴스 20대 체크카드 추천 대학생이 쓰면 개이득인 체크카드 BEST7,0
버거킹도 와퍼 등 12개 메뉴 100원씩 올려,0
마니커에프앤지 코스닥 상장 통해 최고의 육가공 회사 도약,1
유앤비X유니티 햄버거 브랜드 CF모델 발탁매력 大분출’,0
신세계몰 오픈 22주년 기념쓱닷컴 쓱가 대축제에서 구입하면 좋은 할인 상,1
미국인 외식비 지출 꾸준히 증가지난해에도 6나 증가,1
버거킹 와퍼 3종 35 할인 행사 전개3900원 균일가,0
타코벨 버거킹 제치고 미 식당 체인점 4위,0
버거킹 풍성한 고객 혜택 담은 5월 프로모션 진행,0
버거킹 풍성한 고객 혜택 담은 5월 프로모션 진행,0
햄버거 위해 뭉친 유앤비X유니티,0
버거킹 제26회 국민이 선택한 좋은 광고상 수상,1
콰트로치즈가 뭐길래’치즈에 빠졌다,0
커피전문점·패스트푸드점 일회용컵 사용 확 줄었다매장내 수거량 72 ↓,0
커피전문점·패스트푸드점 1회용컵 수거량 72 감소,0
대한항공 셀프 체크인 경품행사 진행,0
마켓인사이트공모주 일반 청약 격돌 마니커에프앤지나노브릭 엇갈린 성적,0
트럼프 연준 흔들기 점입가경,0
주말쇼핑정보 쿠팡·옥션 봄 프로모션부터 KFC·요기요 먹거리 할인까지,0
마켓인사이트공모주 일반 청약 격돌 마니커에프앤지나노브릭 엇갈린 성적,0
트럼프 연준 흔들기 점입가경,0
주말쇼핑정보 쿠팡·옥션 봄 프로모션부터 KFC·요기요 먹거리 할인까지,0
야생의 땅듀랑고 버거킹 제휴 이벤트버거킹 몬스터와퍼’ 쿠폰 지급,1
버거킹 더블킹 시리즈 신제품 더블치킨맨’ 출시,1
바로고 일 배달 콜 수 20만건 돌파역대 최고치,1
10년전 가격 vs 11버거킹·롯데리아 3번째 이벤트 격돌,0
일동제약 아로나민’ 전 세계 가장 지속가능한 브랜드 우수그룹 선정,0
美 패스트푸드점 채식버거 열풍 도입 후 이용량 ↑,1
네이버 자회사 스노우 잼라이브 폭발적 인기로 수익모델 엿봐,1
일동제약 아로나민’ 전 세계 가장 지속가능한 브랜드 우수그룹 선정,0
美 패스트푸드점 채식버거 열풍 도입 후 이용량 ↑,1
네이버 자회사 스노우 잼라이브 폭발적 인기로 수익모델 엿봐,1
내달 상장 마니커FG 식품소비 트렌드 변화 수혜,1
할로윈 즐겨요배스킨라빈스·버거킹 프로모션 진행,0
버거킹 대표 프리미엄 와퍼 3종 할인 행사 진행,0
기후변화를 품다 정치보다 기후변화 심각하다,0
KT 멤버십 5Good위크’로 캐리비안베이 반값에,0
롯데리아 vs 버거킹 프로모션 재격돌당신 선택은,0
