title,label
2조짜리 기업 5년새 6조로 키워PEF의 기업가치 연금술,0
버거킹 인기메뉴를 5000원에 즐길 수 있는 35주년 프로모션 진행,1
Hot 할인이벤트 뚜레쥬르·교촌치킨·배스킨라빈스·파리바게뜨·버거킹,0
부산국제광고제 3일간 일정을 폐막식으로 마무리,0
커넥츠 자단기 정기 기사 ·한국사능력검정 시험 직후 합격 확인 서비스 실시,0
버거킹 몬스터 시리즈 인기800만 개 판매 돌파,1
버거킹 올데이킹 메뉴 리뉴얼,0
버거킹 배달의민족과 콜라보 팝업북 제작·판매 수익 기부,1
버거킹이 베트남 버거를 인종차별적으로 광고한 방법 영상,0
디쉐어DSHARE VIG파트너스로부터 1650억원 투자 유치 성공,1
직원이 미소지었나요” 억지 친절’ 강요하는 고객 설문,1
버거킹 카톡 플친 맺으면 프리미엄 와퍼 콤보 할인,0
소비자가 쓰앵님’ 버거킹·농심·삼양 신제품 탄생 비화,1
가성비 전략으로 반등한 패스트푸드맘스터치 이익률 8로 1위,1
버거킹 몬스터 시리즈 탄생 1년 · 무료 세트 업그레이드 이벤트 진행,0
버거킹 매장 방문 대상 프리미엄 와퍼 콤보 5900원’ 행사 실시,0
버거킹 딜리버리 메뉴 가격 200원씩 인상,0
독퍼’ 새로운 논란 더해질까 사람밥 만드는 데서 개밥 웬 말”,1
美 버거킹 반려견 전용 버거 독퍼 출시 애견인들 환영,1
버거킹 카카오톡 플러스친구 추가사딸라 이모티콘 무료,0
버거킹 카톡플친수 280만명 돌파,1
식물성 고기 급성장전통 육류 넘보나,0
버거킹 프리미엄 와퍼  코카 콜라 콤보를 단품보다 저렴하게 즐기세요,0
뉴스투데이 E 버거킹 최고의 킹 가리는 킹스 배틀’ 시작,1
유통 물류가 바꾼다①사람 대신 시스템이 배달하는 곳 메쉬코리아,0
한눈 미국경제 버거킹 광고에 젓가락을 사용하는 장면으로 논란,-1
버거킹도 올린다딜리버리 메뉴 200원씩 인상,0
버거킹 사딸라 올데이킹’ 400만 세트 판매 돌파,1
버거킹 우버이츠 론칭 기념 프로모션 실시,0
롯데리아 이어 버거킹도 가격인상배달 메뉴만 200원 ↑”,0
통모짜와퍼 판매 안하는 지점도 있다 이탈리아의 모짜렐라 풍미 가득,0
밈·짤방이 소환한 야인시대 버거킹 사딸라 광고 인기,1
간단한 아침식사 맥도날드 맥모닝·버거킹 킹모닝 롯데리아는 아침메뉴 시,0
버거킹 올데이킹 사딸라 TV CF 패러디 영상 공모전 실시,0
글로벌사건 24 뉴욕시 누명으로 30년 감옥살이 필라델피아 남성에게 118억,0
버거킹 독퍼 사람이 먹어도 될까유튜버들 사이에서 벌써부터 인기,1
소비자민원평가패스트푸드 햄버거 이물질 문제 다발매출 1위 롯데리아,1
빅맥 천원보다 더 이득 맥도날드 7월 행사는 버거킹KFC롯데리아 7월행사도,0
간단한 아침식사 맥도날드 맥모닝·버거킹 킹모닝 롯데리아는 아침메뉴 시,0
버거킹 28일부터 배달서비스 메뉴당 200원씩 가격 인상,0
버거킹 올데이킹 사딸라 TV CF 패러디 영상 공모전 실시,0
글로벌사건 24 뉴욕시 누명으로 30년 감옥살이 필라델피아 남성에게 118억,0
버거킹 독퍼 사람이 먹어도 될까유튜버들 사이에서 벌써부터 인기,1
소비자민원평가패스트푸드 햄버거 이물질 문제 다발매출 1위 롯데리아,1
빅맥 천원보다 더 이득 맥도날드 7월 행사는 버거킹KFC롯데리아 7월행사도,0
꿀할인꿀이벤 브이티코스메틱·버거킹·아리따움·에뛰드하우스·던킨도너,0
버거킹황금돼지해 저렴하고 넉넉한 New 킹박스 눈길,0
HOT 세일이벤트원할머니보쌈족발·육수당·버거킹,0
HOT 세일이벤트원할머니보쌈족발·육수당·버거킹,0
버거킹 가심비 중시하는 소비자들 위한 올데이킹 프로모션 진행,0
버거킹도 가격인상딜리버리 메뉴 200원 오른다,0
버거킹 한국진출 35주년 기념인기메뉴 3종 2개 5000원 프로모션,1
글로벌Biz 24 한국에서 할인 공세 벌이는 버거킹 미국에선 바닥 청소한,0
칸 라이언즈 2019 제일기획 해외법인 삼성 Back2Life로 동상 지속가능,0
버거킹 한 달에 단 5달러로 매일 커피 즐기세요”,0
롯데리아·맥도날드·버거킹·서브웨이 7월 행사 할인되는 메뉴는 서브웨이,0
버거킹 카톡 플친 대상 프리미엄 와퍼 콤보’ 행사 실시,0
맥도날드 버거킹6 월행사 특가 메뉴 할인 제외 매장 알아둬야 맥도날드,0
버거킹 몬스터 시리즈’ 월 100만개씩 팔렸다누적 800만개 돌파,1
KT 버거킹뚜레쥬르 12월 더블할인’받으려면,0
신제품 러쉬 롯데리아·맥도날드·버거킹 7월 행사와 할인 메뉴신제품 흑,1
버거킹 올데이킹 사딸라 TV CF 패러디 영상 공모전 실시,0
글로벌 돋보기 고기’ 안 들어간 고기’는 고기’일까 아닐까,0
버거킹 와퍼클래식 더블와퍼베이컨치즈와퍼 세트 업 쿠폰 오는 21일까지,0
버거킹 볼케이노칠리와퍼와 볼케이노칠리프라이 출시,1
버거킹 월 5불로 매일 커피 즐기세요,0
버거킹 독퍼 뜨거운 반응美 이미 5개월 前 출시,1
침체된 IPO시장절반은 제 몫 했다,0
독퍼 무료로 받는법 햄버거 맛 그대로 살린 반려견 간식’,0
버거킹 몬스터 시리즈 900만개 판매돌파 기념 이벤트 진행,1
버거킹 와퍼 6200→6400원딜리버리 메뉴 가격 200원씩 인상,0
기자수첩 대체육 채식버거 방목형축산 보다 친환경 먹거리 도입되나,0
국내 진출 35주년 버거킹 인기메뉴 3종 5000원 할인 프로모션 진행,1
버거킹 사이드메뉴 트러플허니 아이스크림 출시기념 할인 프로모션,1
버거킹 버거킹X코카콜라 콜라보레이션 보틀 증정 행사 진행,0
프랜차이즈 단신 도미노피자·버거킹·맥도날드,0
손흥민에 원숭이’ 햄버거에 젓가락’ 인종차별인 이유,0
펀’한 버거 사이드메뉴메인 뺨치네,0
펀’한 버거 사이드메뉴메인 뺨치네,0
뉴질랜드 버거킹의 젓가락으로 먹는 버거 광고가 아시아인 비하 논란에 휩,-1
롯데리아에 가짜고기 버거가 뜬 까닭은,0
맥도날드 놀리는 버거킹 스웨덴 빅맥인듯 빅맥아닌 빅맥같은 메뉴 출시,1
하루종일 4900원 vs 4딸라맥도날드·버거킹 세트 전쟁,0
반려견 위한 와퍼 독퍼 무료로 받으세요,0
버거킹 새해 맞이 올데이킹 리뉴얼4종으로 확대,0
프랜차이즈 단신 던킨도너츠·버거킹·bhc치킨,0
버거킹 카카오톡 플친 볼케이노 칠리와퍼 단품 구매시 프렌치프라이콜라 ,0
버거킹 배달 메뉴 200원씩 인상,0
버거킹 28일부터 배달 메뉴 가격 200원씩 인상,0
맥도날드 영국서 극우정치인에 밀크셰이크 잇단 투척 판매 중단,-1
버거킹 35돌 이벤트와퍼주니어 하나 사면 하나 더 드려요,0
화제의 버거킹 사딸라 광고 패러디하고 푸짐한 상금도 받자,0
넷플릭스 대박 낸 구독 경제의 비밀,1
버거킹 사딸라 올데이킹 400만 세트 판매 돌파,1
HOT 세일이벤트11·50 프로모션 버거킹·죠스떡볶이·더본코리아,0
이마트가 쓱 제안한 삼성 가전 공짜로 갖는 법,0
아시아 여성 비하 광고로 돌아보는 인종차별 논란 광고 4,-1
떠오르는 토종 패스트푸드 브랜드 맘스터치’ B급 상권·가성비·SNS 타고,0
에어드레서가 공짜이마트 eward 프로모션,0
아시아 여성 비하 광고로 돌아보는 인종차별 논란 광고 4,-1
떠오르는 토종 패스트푸드 브랜드 맘스터치’ B급 상권·가성비·SNS 타고,0
맥도날드가 유럽에서 빅맥 상표권 잃자 버거킹이 한 행동,0
O2O특집라이더 4만명 바로고 배달 품질 혁신,0
버거킹 햄버거 값도 오른다딜리버리 메뉴 가격 200원씩↑,0
디쉐어 VIG파트너스로부터 1650억 원 투자 유치 성공,1
KT 더블할인 멤버십 버거킹 몬스터X 반값,0
아시아 최대의 크리에이티브 축제’ 제12회 부산국제광고제 3일간 진행 성,0
버거킹 애완견용 버거 출시,1
아시아 최대의 크리에이티브 축제’ 제12회 부산국제광고제 3일간 진행 성,0
버거킹 애완견용 버거 출시,1
꿀할인꿀이벤 더본코리아 0410데이·아리따움·미샤데이·버거킹 5000원·,0
버거킹 광고 인종차별 논란햄버거 젓가락으로 먹는 장면 담아,-1
버거킹 신제품 와퍼클래식 2종 출시,1
버거킹 세트메뉴 3종 할인 판매 올데이킹 진행,0
버거킹 브리오슈 번X비프칠리소스 볼케이노칠리X 출시 기념 무료 세트업,1
月 40만원 긁었을 뿐인데119만원 에어드레서가 공짜’,0
광고주 발굴 위해 주지스님 앞에서도 프레젠테이션,0
미스터펫자’독퍼’ 믿고 먹여도 될까요,0
미스터펫자’독퍼’ 믿고 먹여도 될까요,0
3억달러 투자유치한 임파서블푸드,1
버거킹 크리스마스 맞이 X시리즈 세트업 프로모션 실시,0
버거킹 딜리버리 서비스 메뉴 47 인상,0
버거킹 카톡플친 브랜드 채널 중 친구수 280만명 1위 등극,1
버거킹 2019년 새해맞이 올데이킹 리뉴얼,0
지파이독퍼맥윙버거 프랜차이즈 사이드 메뉴’ 열전,0
디쉐어 VIG파트너스로부터 1650억원 투자 유치 성공,1
버거킹 크리스마스 시즌 코카콜라 콜라보 보틀 선착순 증정,0
맥도날드 비욘드미트와 손잡고 식물성 고기 버거 시험판매,0
맥도날드 비욘드미트와 손잡고 식물성 고기 버거 시험판매,0
롯데리아 5월행사 와규버거 가격이 무려 버거킹·맥도날드 특급할인’ 이,0
버거킹 Xmas 맞이 X시리즈 세트업 프로모션 실시,0
해커스공무원 10월 지방직∙서울시 7급 합격예측 풀서비스 이벤트 오픈,1
더벨본촌치킨 밸류업 버거킹 전례 따를까,0
버거킹 이번 한달 하루종일 햄버거감튀콜라 세트 단돈 4900원,0
영양 균형 햄버거 이젠 건강식이라 불러다오”,0
뉴스투데이 E 버거킹 사딸라” 김영철 카톡 이모티콘 증정,0
버거킹 새해맞아 올데이킹 리뉴얼,0
버거킹 프리미엄 와퍼  코카 콜라 콤보를 할인된 가격으로 즐기세요,0
버거킹 봄맞이 인기 사이드 메뉴 3종 할인 프로모션 진행,1
채식 버거 임파서블 푸드 몸값 상한가,0
40만원 쓰면 에어드레서’가 공짜” 이마트 eward’ 캐시백 프로모션,0
버거킹 카카오톡 플친 대상으로 와퍼클래식 2종 무료 세트 업 쿠폰 증정,0
버거킹 몬스터 시리즈 900만개 판매 기념세트 업그레이드 행사,0
배달의민족 버거킹과 콜라보 팝업북 제작,1
버거킹 배달서비스 메뉴당 200원씩 가격 인상,0
버거킹배달의 민족 공동 마케팅,0
신메뉴 크리미 모짜볼 더한 버거킹 킹박스’ 오는 30일까지 판매,1
버거킹 TV CF 패러디 영상 공모전 실시,0
신메뉴 크리미 모짜볼 더한 버거킹 킹박스’ 오는 30일까지 판매,1
버거킹 TV CF 패러디 영상 공모전 실시,0
MT리포트 가짜고기 만들어 대박난 회사들,1
지식공유 플랫폼’ 디쉐어 1650억 투자유치 쾌거,1
버거킹 몬스터X 40 할인 프로모션 실시,0
버거킹 1000원에 판매하는 치즈스틱 등 사이드 메뉴 할인 프로모션 진행,0
빌게이츠·김정주·리카싱비건버거 임파서블푸드 투자자 줄섰다,0
버거킹 배달의민족과 콜라보 팝업북 제작  판매 수익 전액 기부,1
이마트 신개념 공짜찬스eward’ 캐시백 프로모션,0
버거킹 몬스터 시리즈 900만개 판매 돌파 기념 세트 업그레이드 진행,1
이마트 신개념 공짜찬스eward’ 캐시백 프로모션,0
버거킹 몬스터 시리즈 900만개 판매 돌파 기념 세트 업그레이드 진행,1
오늘의 유통 단신 이랜드 월드비전에 2천만 원 기부 外,1
위메프 버거킹 세트 단돈 5500원에 판매관심 급부상,1
투자자들이 KFC·버거킹·맥도날드를 질타한 이유,0
버거킹 몬스터 시리즈 800만 개 판매 돌파 기록,1
버거킹 할로윈 이벤트로 웹어워드 코리아서 프로모션 통합대상 수상,1
버거킹배달서비스 메뉴당 200원씩 가격 인상,0
솔로이코노미 동향 로켓배송 최소 주문 한도 부활·버거킹 커피구독 서비스,0
버거킹 배달서비스 가격도 올린다,0
솔로이코노미 동향 로켓배송 최소 주문 한도 부활·버거킹 커피구독 서비스,0
버거킹 배달서비스 가격도 올린다,0
뉴욕리포트美 증시 식물성 고기 바람비욘드미트 한달 새 4배 폭등,0
버거킹 배달의민족과 협업 캠페인 전개,0
버거킹이 깜짝 공개한 코카콜라 콜라보 보틀 증정 이벤트 실물 사진,0
에그셀런트 최신 창업트렌드에 맞춘 시스템 갖춰예비창업주들에게 주목,1
사딸라’·인싸댄스’ 밀레니얼 화제 광고 만든 물리학도,1
맥도날드 Vs 버거킹 전통의 강자 그리고 위협하는 도전자,0
월간십일절 빕스 90 할인으로 1100원 혜택 방법은 19일에도 이벤트 진행,0
버거킹 35주년 맞이 와퍼주니어 11 행사 진행,0
버거킹 35주년 맞이 와퍼주니어 11 행사 진행,0
롯데리아·버거킹 이어 맥도날드도 다음달 12일 가격 인상,0
버거킹 햄버거세트 나트륨 폭탄 하루권장량 훌쩍,0
버거킹 음식배달앱 론칭 기념 몬스터X 할인 프로모션 진행,0
이마트 몽골에 3호점 개장울란바토르서 가장 큰 규모,0
버거킹 인종차별 논란,-1
버거킹 카톡 플러스 친구 286만명 돌파,1
버커킹 사딸라 올데이킹ALL DAY KING 이모티콘 무료 배포 실시,0
롯데리아vs던킨도너츠 토이스토리 비교해보니 6월 행사 무엇 버거킹·맥도,0
식음료 프랜차이즈 인수한 사모펀드들 엑시트 못해 발동동,0
이마트 이워드 프로모션’월 할부금 캐시백,0
버거킹 28일부터 딜리버리 메뉴 가격 200원 인상,0
인간이 먹는 것 아니다 버거킹 애완견용 버거 출시,1
식약처 버거킹·맘스터치 등 식품위생법 위반 업소 96곳 적발,-1
25개월간 40만원 쓰면 에어드레서가 공짜 이마트 캐시백 프로모션,0
통모짜와퍼 어떤 맛일까 신제품 이벤트 놓쳐선 안돼,1
IoT 플랫폼 포레스트’ 똑똑한 실내 온도 관리로 전기세 절감여름철 냉방,0
Burger King Releases Real Meals’ in Mental Health Awareness Campaign,0
버거킹 와퍼주니어 11 프로모션 진행,0
버거킹 올데이킹 사딸라’ 패러디 영상 공모전 실시,0
버거킹 올데이킹 사딸라’ 패러디 영상 공모전 실시,0
11번가 월간십일절 맞아 빕스 등 최대 90 할인쿠폰 제공,0
버거킹 New 킹박스’ 출시,1
딜링룸 백브리핑 짐 로저스가 추천한 투자 서적은,0
MT리포트육·해·공또 하나의 고기 특별한 맛보기,0
버거킹 프리미엄 와퍼와 콜라가 5900원이번주 내내,0
버거킹 맥도날드서 와퍼 주문하면 단돈 1센트’,0
뉴트로’ 광고도 접수,0
맘스터치 서울 100호점 돌파가성비의 힘,1
버거킹X배달의민족 광고비는 누가 집행하는 것일까,0
버거킹 몬스터 할인 프로모션 실시,0
롯데리아·버거킹·맥도날드 6월 행사 롯데리아 지파이 무료 증정부터 100,0
버거킹 28일부터 딜리버리 메뉴 가격 200원씩 인상,0
아스널 꺾은 바테 버거킹 회식 후 일반석 런던행,0
버거킹 킹박스 리뉴얼 출시,1
버거킹 소비자 성원에 크리미 모짜볼 정식 메뉴로,0
11번가 월간 십일절 3월 테마는 미세먼지,0
버거킹 크리스마스 맞아 X시리즈 단품가격에 세트 드려요,0
햄버거에서 짜장 라면까지트러플’에 빠진 식품업계,0
써봤습니다 햄버거3사 앱 어느 게 가장 편리할까,0
써봤습니다 햄버거3사 앱 어느 게 가장 편리할까,0
버거킹 크리미 모짜볼’ 신메뉴 출시,1
대상·삼양사는 왜 GMO표시제를 반대할까,0
할배 모델 뽑아 B급 광고 찍고 초대박 난 브랜드 4,1
11번가 십일절 샤오미 프로 공청기 13만9천원 판매,0
유통워치 KTG 상상마당 대치 문화예술 공간으로 새 단장 外,0
세트하시면 가격은” 주문받던 버거킹 알바가 말문 막힌 이유 영상,0
맥도날드 식물성 고기 버거 지켜보는 단계,0
지금 미국에서는 버거킹 와퍼를 10원에 살 수 있다,0
버거킹 반값에” 12월 KT 더블할일 멤버십 누리자,0
6월 보릿고개 넘어라” 앞다퉈 할인경쟁,0
오늘의 유통 소식 대상 청정원 분짜·닭쌀국수 등 베트남 소스 2종 출시,1
파리바게뜨 캄보디아 진출내년 프놈펜에 매장 오픈,1
버거킹 배달의민족과 우리 민족이었어 협업 캠페인,0
버거킹 2019년 새해맞이 올데이킹ALL DAY KING 리뉴얼,0
KT 멤버십 12월 버거킹 최대 50 할인,0
패스트푸드 미래는 여기에 맥도날드도 채식버거 참전,0
햄버거 세트 나트륨 함유량 버거킹 최고아차 하면 하루치 섭취,1
버거킹 몬스터 시리즈 900만개 판매 기념 매장 이벤트,0
11번가 3월 십일절 미세먼지 관련 특집 기획전 진행,0
버거킹 몬스터 시리즈 900만개 판매 기념 매장 이벤트,0
11번가 3월 십일절 미세먼지 관련 특집 기획전 진행,0
대체육 유니콘’의 탄생2020년 세포농장 고기가 온다,0
채식 고기 스타트업 비욘드미트 나스닥 상장 첫날 주가 163 상승 돌풍,1
앤디 워홀이 먹방과 ASMR의 시초 버거킹 슈퍼볼 광고 화제,0
버거킹 올데이킹 사딸라 5종으로 확대 리뉴얼’,0
여름철 냉방비 걱정 없는 IoT 플랫폼 포레스트 똑똑한 실내 온도 관리로 전,0
버거킹 세트메뉴 4900원에 판매 올데이킹 론칭,0
써브웨이 버거킹 맘스터치 등 유명 프랜차이즈 업소 식품위생법 위반,-1
캘리포니아피자키친 글로벌 메뉴 도입으로 새 단장,0
캘리포니아피자키친 글로벌 메뉴 도입으로 새 단장,0
美버거킹 반려견용 버거 출시댕댕이도 함께 즐겨요,1
버거킹 와퍼 가격 오른다,0
최고 전망 프리시디오 버거킹 건물 철거,1
버거킹 카카오톡 플친 몬스터와퍼 구매 시 무료 세트 업 쿠폰 증정,0
25개월간 이마트서 40만 원 쓰면 에어드레서’가 공짜 캐시백 프로모,0
버거킹 정통 수제버거 풍미 와퍼클래식 출시,1
버거킹 X시리즈 세트업’ 프로모션 실시,0
글로벌Biz 24 맥도날드 해피밀 플라스틱 장난감 폐지 청원에 32만5000명 서,0
햄버거세트 칼로리 폭탄버거킹 몬스터 X’ 최고,1
KT12월 멤버십 혜택 버거킹·뚜레쥬르 할인해준다,0
평생 공짜식사라더니美남성 버거킹 상대 소송,-1
마트에 등장한 e워드’ 캐시백고객 확보에 아이디어 짜내는 대형마트,0
리얼푸드 식탁에서 맞이하는 지구의 날’아몬드부터 대체육까지,0
두달째 불타는 아마존 화재원인이 소고기 때문,0
모짜렐라 치즈 흘러넘치는 달콤짭짤 버거킹 크리미모짜볼 단품으로 출시된,1
버거킹 배달의민족과 우리 민족이었어’ 협업 캠페인 전개,0
기아차 캠페인 자동차 미디어 부문 1위 WARC 세계 광고업계 역량 랭킹 발,1
G마켓 슈퍼프라이데이’ 연다 버거킹 몬스터x세트 5940원”,0
버거킹 올데이킹 프로모션 세트메뉴 3종을 하루 종일 4900원에 만난다,0
버거킹 올데이킹 프로모션 세트메뉴 3종을 하루 종일 4900원에 만난다,0
사람과 개 먹거리 문제론 동급프랜차이즈 음식점 반려동물용 음식 ,-1
버거킹이 혼자서 와퍼를 먹기 곤란한 반려인들을 위해 내놓은 상품영상,0
송영길 죽음 앞 성완종 메모도 배척한 법원 드루킹은,0
버거킹 크리스마스 맞아 X시리즈 세트업 프로모션 진행,0
11번가 3월 십일절 테마 미세먼지 관련 상품 최대 53 할인,0
버거킹 하루 종일 세트를 4900원에 푸짐하게 즐기자,0
게시판 KT 버거킹·뚜레쥬르 특별 할인 혜택,0
손님에게 평생 공짜 식사 제공한다고 해놓고 몇 주 만에 말 바꾼 버거킹,0
마켓인PEF에서 PEF로 손바뀜 늘어나는 세컨더리 딜,0
맥도널드까지 파고든 채식버거,0
버거킹 신메뉴 크리미 모짜볼 담은 새 킹박스 출시,1
배민 쿠폰 송혜교 신발 6개월간 가장 많이검색 커머스 포털로 진화한 11번가,1
ONE SHOT 햄버거 간식으로 한 끼 식사로당신의 최애’ 브랜드는,0
시니어 모델 능청연기유머 광고’ 젊은이도 빵 터졌네,0
美대학풋볼우승팀 백악관 만찬메뉴는 패스트푸드,0
버거킹 크리미 모짜볼’ 정식 메뉴 출시,1
버거킹 Xmas 코카콜라 콜라보레이션 보틀 선착순 증정 행사,0
버거킹 더블와퍼  베이컨치즈와퍼 출시,1
젓가락으로 햄버거를 먹는 광고,0
버거킹 야인시대 패러디한 사딸라 광고로 온라인상에서 뜨거운 반응,0
궁예·살인의 추억·김두한을 다시 만나다 광고계 장악한 뉴트로 열풍,1
biz 인사이드 맘스터치 패기충만 22살 브랜드’ 돌풍 언제까지,1
버거킹 올데이킹ALL DAY KING 출시,1
김택진 대표 보수는 직원의 154배30대 상장사 평균 격차는 30배,0
버거킹 얼얼한 매운맛으로 무장한 앵그리몬스터X 10월 한정 출시,1
버거킹 정통 아메리칸 수제 버거 맛 더블와퍼  베이컨치즈와퍼 선보여,1
인싸Eat맥도날드마저 고기를 버렸다,1
버거킹 카톡 플친 브랜드 채널 중 친구 수 1위 등극,1
KT 12월 멤버십 혜택 버거킹·뚜레쥬르 할인 등 크리스마스 이벤트 풍성,0
버거킹 2019년 4차 신입경력 정규직 영업관리직Manager 채용 4월 7일 18시,0
버거킹 웹 프로모션도 킹,0
롯데리아·맥도날드·버거킹 6월 행사 총정리 이벤트 응모하면 100만 원이,0
버거 프랜차이즈 사이드 메뉴 차별화로 고객 유입,0
정현식 회장 가맹점주 수익 올려주는게 최고의 상생”,1
10원에 와퍼 먹으려면 맥도날드를 가라 버거킹의 얄미운’ 마케팅,0
국내 햄버거 프랜차이즈 8월 다양한 이벤트로 만난다,0
버거킹 카톡 플친 브랜드 채널서도 킹,0
KT 12월 더블할인 멤버십 진행 버거킹 뽀로로파크 등 풍성,0
유통오늘 팔도 비락식혜 어벤져스 스페셜 패키지 출시,1
버거킹 12월 올데이킹 메뉴 출시,1
지갑 열기 겁나는 물가 인상 아이스크림·커피까지 소비 부담 커진다,0
박명호 경영칼럼 장사의 비결 사딸라가 답일까,0
건물주 이랜드가 세입자 스타벅스에 갑질하는 방법,-1
두달째 불타는 아마존 화재원인이 소고기 때문,0
버거킹 팝업북 판매 수익 전액 기부,1
버거킹 Xmas 맞이 X시리즈 세트업 프로모션 실시,0
버거킹 킹박스 치즈메뉴 신제품 추가로 더욱 알찬 구성 선보인다,1
KT와 버거킹의 맛있는 만남 12월 멤버십 혜택 즐겨요,0
1900원 버거·1500원 커피매장 성황온라인몰 한달내내 각종 할인이벤트,0
1900원 버거·1500원 커피매장 성황온라인몰 한달내내 각종 할인이벤트,0
파리바게뜨 캄보디아 간다,0
이마트eward 토스 행운퀴즈 5개 정답은 최신 가전제품 4종 할부금 지원,0
오는 18일까지 육즙 좔좔 버거킹 와퍼주니어불고기와퍼주니어 단돈 4천원,0
biz 인사이드 KFC 매장 신설 때마다 홍보 열 올리는 이유,0
버거킹 앵그리몬스터X 버거 출시,1
평생 버거킹 공짜’ 약속 파기에 발끈 美男 1000만원 지급 소송”,-1
이마트 25개월간 40만원 쓰면 에어드레서가 공짜eward 캐시백 프로모,0
버거킹 배달의민족과 팝업북 제작···판매 수익 전액 기부,1
서민 음식의 배신햄버거 빅3 설 앞두고 가격 기습 인상,0
버거킹 배달의민족과 팝업북 제작···판매 수익 전액 기부,1
서민 음식의 배신햄버거 빅3 설 앞두고 가격 기습 인상,0
버거킹 와퍼주니어 11 프로모션 진행,0
버거킹 올데이킹 사딸라 5종으로 확대 리뉴얼더블비프디아블로세트 선봬,0
다가오는 Xmas 버거킹 X시리즈 무료 세트 업그레이드로 푸짐하게 즐겨요,0
버거킹 몬스터 시리즈 800만개 판매 돌파,1
버거킹 28일부터 딜리버리 메뉴 가격만 200원씩 인상,0
SPC HSC그룹과 손잡고 캄보디아 진출,1
천연 색소로 만든 버거킹 앵그리몬스터X,0
세상읽기 그들이 본 것  홍은전,0
천연 색소로 만든 버거킹 앵그리몬스터X,0
세상읽기 그들이 본 것  홍은전,0
SPC그룹 파리바게뜨 캄보디아 진출,1
카톡 플친 모여라 버거킹 프리미엄 와퍼 콤보 5900원 행사,0
KT 버거킹·뚜레쥬르 12월 더블할인 혜택 제공,0
美 버거킹 月 5弗 내면 매일 커피 1잔프랜차이즈도 구독 경제 바람 불까,0
